{
  "$schema": "https://raw.githubusercontent.com/Roboticela/DevKit/main/cli/schemas/devkit-config.json",
  "devkit": "1.0",
  "template": "vite-express-tauri",
  "site": {
    "name": "DevKit",
    "url": "https://devkit.roboticela.com"
  },
  "theme": {
    "preset": "minimal",
    "colors": {
      "primary": "#6366f1",
      "secondary": "#f59e0b"
    },
    "fonts": {
      "sans": "Inter",
      "mono": "JetBrains Mono",
      "display": "Inter"
    },
    "radius": "md",
    "darkMode": true,
    "darkModeStrategy": "class"
  }
}
